ref,category,reply
248,Walter Sobchak,"The Chinaman is not the issue here, Dude! I'm talking about drawing a line in the sand, Dude. Across this line you do not,  and also, Dude, Chinaman is not the preferred nomenclature. Asian-American, please."
249,The Dude,"There is an unspoken message here, it's FUCK YOU, LEAVE ME THE FUCK ALONE! ... Yeah, I'll be at practice."
250,The Stranger,"They call Los Angeles the City of Angels. I didn't find it to be that exactly, but I'll allow as there are some nice folks there. 'Course, I can't say I seen London, and I never been to France, and I ain't never seen no queen in her damn undies as the fella says."
251,The Dude,They finally did it. They killed my fucking car.
252,Donny,"They were Nazis, Dude?"
253,The Dude,"This is a very complicated case, Maude. Lotta ins, lotta outs, lotta what-have-yous. It's a complicated case, Maude. Lotta ins, lotta outs. Fortunately I've been adhering to a pretty strict drug regimen to keep my mind, you know, limber."
254,Walter Sobchak,This is not Nam. This is bowling. There are rules.
255,Walter Sobchak,"Three thousand years of beautiful tradition, from Moses to Sandy Koufax, YOU'RE GODDAMN RIGHT I'M LIVING IN THE PAST!"
256,Kidnapper,"Vee belief in nossing, Lebowski! Nossing!"
257,The Dude,"Walter, this is not a First Amendment thing, man."
258,Walter Sobchak,"We can't do that, Dude. That fucks up our plan."
259,The Dude,"Well no, like I said, Woo peed on the rug."
260,The Dude,"What are you, a fucking park ranger now? Who gives a shit about the fucking marmot?"
261,Walter Sobchak,"What do you mean ""brought it bowling""? I didn't rent it fucking shoes. I'm not buying it a fucking beer. He's not taking your fucking turn, Dude."
262,The Dude,"Yeah, man, it really tied the room together."
263,The Dude,"Yeah, that's a great plan, Walter. That's fucking ingenious. It's a Swiss fucking watch."
264,The Dude,Yeah? Waving the fucking gun around?!
265,Walter Sobchak,Yeah? What do you think happens when you get divorced? You turn in your library card? Get a new driver's license? Stop being Jewish?
266,Funeral,"Yes, sir. It is our most modestly priced receptacle."
267,Walter Sobchak,"You want a toe? I can get you a toe. Believe me. There are ways, Dude. You don't wanna know about it, believe me. Hell, I could get you a toe by 3 o'clock this afternoon, with nail polish."
268,Maude,"You will receive no bill. He's a good man, and thorough."
269,Big Lebowski,"Your revolution is over, Mr. Lebowski! Condolences! The bums lost! My advice is, do what your parents did! Get a job, sir! The bums will always lose, do you hear me, Lebowski? THE BUMS WILL ALWAYS LOSE!"
270,The Dude,You're fucking Polish Catholic.
